{
  "schema": "xnet-frontier-qualification-v1",
  "status": "passed",
  "failure": null,
  "source": {
    "sha": "c6f0eb685ae7c78c38de582e92dfe48765c02fe7",
    "worktree_clean": true,
    "archive_sha256": "486348393a76b43e6f281f96b7699b7885a9da69e8217150af2b126aa0bdc41e"
  },
  "environment": {
    "modules": [
      "craype-x86-trento",
      "libfabric/2.3.1",
      "craype-network-ofi",
      "xpmem/1.0.1-1.5_1_gfb6998056825",
      "Core/25.03",
      "tmux/3.4",
      "hsi/default",
      "lfs-wrapper/0.0.1",
      "DefApps",
      "craype-accel-amd-gfx90a",
      "git/2.47.0",
      "subversion/1.14.2",
      "python/3.13.0",
      "vim/9.1.0437",
      "PrgEnv-cray/8.6.0",
      "cray-dsmml/0.3.1",
      "cray-pmi/6.1.16",
      "craype/2.7.35",
      "perftools-base/25.09.0",
      "rocm/6.4.2",
      "cpe/25.09",
      "cce/20.0.2",
      "cray-libsci/25.09.0",
      "cray-mpich/9.0.1",
      "darshan-runtime/3.4.7-mpi",
      "hipfort/6.4.2"
    ],
    "compiler": {
      "artifact": "environment/compiler.stdout.txt",
      "sha256": "edee434c7b8d13f08b37b6d3e1f38f4a23716f54a79bea47ba4f3277ac3aaecc",
      "runtime_seconds": 0.1428880882449448
    },
    "preprocessor": {
      "artifact": "environment/preprocessor.stdout.txt",
      "sha256": "7fe8f551c282d1a6e4a76920057ca321aab2a951f46514043a4d628da4014f0c",
      "runtime_seconds": 0.031106319278478622
    },
    "rocm": {
      "artifact": "environment/rocm.stdout.txt",
      "sha256": "80919f7880d521d266a8281b7a7ddfdd677095e2a9c631e80eb4a4206cc7f5aa",
      "runtime_seconds": 0.17697769170626998
    },
    "gpu": {
      "artifact": "environment/gpu.stdout.txt",
      "sha256": "a2dad7e967965907f650c66bc13fd04241eff26d77b1a2995198d01fe772ae41",
      "runtime_seconds": 0.29694095300510526
    },
    "gpu_model": "GPU[0]\t\t: Card Series: \t\tAMD Instinct MI250X",
    "rocm_version": "rocm-6.4.2",
    "hipfort_module": "hipfort/6.4.2"
  },
  "slurm": {
    "job_id": "5230728",
    "account_supplied": true,
    "partition": "batch",
    "qos_supplied": false,
    "reservation_supplied": false,
    "nodes": 1,
    "tasks": 1,
    "cpus_per_task": 7,
    "gpus_per_task": 1,
    "time_limit": "00:20:00"
  },
  "builds": {
    "cpu": {
      "status": "passed",
      "variables": {
        "CMODE": "OPT",
        "PE_ENV": "CRAY",
        "MPI_MODE": "OFF",
        "OPENMP_MODE": "OFF",
        "GPU_MODE": "OFF",
        "OPENACC_MODE": "OFF",
        "OPENMP_OL_MODE": "OFF",
        "EOS": "STARKILLER",
        "MATRIX_SOLVER": "dense",
        "LAPACK_VER": "LIBSCI"
      },
      "resolved_variables": "build/cpu/resolved-variables.stdout.txt",
      "timeout_seconds": 1800.0,
      "runtime_seconds": 37.34414627822116,
      "executables": {
        "xnet": {
          "artifact": "bin/xnet-cpu",
          "size": 2007768,
          "sha256": "8bd0503b799a8faad77c774c940622c01342112d1c8ce7483c8164793040ac28",
          "link_evidence": "build/cpu/xnet-link.stdout.txt"
        }
      }
    },
    "gpu": {
      "status": "passed",
      "variables": {
        "CMODE": "OPT",
        "PE_ENV": "CRAY",
        "MPI_MODE": "OFF",
        "OPENMP_MODE": "OFF",
        "GPU_MODE": "ON",
        "GPU_BACKEND": "HIP",
        "OPENACC_MODE": "OFF",
        "OPENMP_OL_MODE": "ON",
        "GPU_LAPACK_VER": "ROCM",
        "EOS": "STARKILLER",
        "MATRIX_SOLVER": "dense",
        "LAPACK_VER": "LIBSCI"
      },
      "resolved_variables": "build/gpu/resolved-variables.stdout.txt",
      "timeout_seconds": 1800.0,
      "runtime_seconds": 135.6051049050875,
      "executables": {
        "xnet": {
          "artifact": "bin/xnet-gpu",
          "size": 8335472,
          "sha256": "5a78cd1ab381c330d0837605460d8faea2f96950d79bfddd3bccbf8c13e77cc4",
          "link_evidence": "build/gpu/xnet-link.stdout.txt"
        },
        "frontier_gpu_linalg_probe": {
          "artifact": "bin/frontier_gpu_linalg_probe-gpu",
          "size": 8239352,
          "sha256": "3d7efdec48bdd0f66bbdc1a37c411550f7316d3fe6943a0154f16bb9a335254f",
          "link_evidence": "build/gpu/frontier_gpu_linalg_probe-link.stdout.txt"
        }
      }
    }
  },
  "inputs": [
    {
      "path": "test/Data_SN160/ab_co",
      "size": 3238,
      "sha256": "bea9615dfea8d5a5dbea529db64e10c1b20012b29b755c1ed3e537cbe7a2f7b3"
    },
    {
      "path": "test/Data_SN160/netsu",
      "size": 325333,
      "sha256": "9dca0e4ae011f9ef3de4090f512ad9b6b31e70454e897e60506cdb75a9867b48"
    },
    {
      "path": "test/Data_SN160/netweak",
      "size": 419760,
      "sha256": "a374458b8b9439ab6c00d71292b89216d08a98c09dd0104f4046e93f28a4ae0f"
    },
    {
      "path": "test/Data_SN160/netwinv",
      "size": 55119,
      "sha256": "af69be084dc05bfd27643696ff6213fd08c085afefb6ce4032a5d04e5fe4a2b2"
    },
    {
      "path": "test/Data_SN160/sunet",
      "size": 960,
      "sha256": "d20da4d9fae2b4093e67d258530c5506cc44b50775b09b797893a1c41effdaac"
    },
    {
      "path": "test/Data_alpha/netsu",
      "size": 9965,
      "sha256": "d8db4febcd495b29075039deabd84217d962cf11b868aac68f9e43ac7e716131"
    },
    {
      "path": "test/Data_alpha/netweak",
      "size": 0,
      "sha256": "e3b0c44298fc1c149afbf4c8996fb92427ae41e4649b934ca495991b7852b855"
    },
    {
      "path": "test/Data_alpha/netwinv",
      "size": 4895,
      "sha256": "679b59567a95076ba771e38b0bff999ca94c21f8b1784025748197774c93cf95"
    },
    {
      "path": "test/Data_alpha/sunet",
      "size": 84,
      "sha256": "cee68d91608fbe3212b177c13c0a89cf003f158044a35e78b009b4db12efb4b1"
    },
    {
      "path": "test/Test_Problems/th_co_burn_1",
      "size": 200,
      "sha256": "ff2d529b177da2ab67dc417b20fb667a9f9e66fffada03c4c461e6d941bc280e"
    },
    {
      "path": "test/Test_Problems/th_co_burn_2",
      "size": 214,
      "sha256": "60e210d0f26882374f07ebab2dee668864202f59ba639ec949758dcfd6d73f72"
    },
    {
      "path": "test/Test_Problems/th_co_burn_3",
      "size": 200,
      "sha256": "7e340cfbd095a50a85571c956e51e0248ae1c12916a697f0c1ebbf9a501ecb0e"
    },
    {
      "path": "test/Test_Problems/th_co_burn_4",
      "size": 214,
      "sha256": "231985efc59022d17434c2213c5e331f22b7a9859e8e43e7c04b07cdb2228023"
    },
    {
      "path": "test/Test_Problems/th_co_burn_5",
      "size": 200,
      "sha256": "7a4382eddb16962dcae56d22dd7167e40282d26b814a77c0b1f100da660bf9c7"
    },
    {
      "path": "test/Test_Problems/th_co_burn_6",
      "size": 214,
      "sha256": "3c5ec71350581ae36a4ced096220fef661779f04efe98fd9666f6e360a5e5554"
    },
    {
      "path": "test/qualification/parallel_zones/abundance_01",
      "size": 342,
      "sha256": "2954758aa2d504ce80b631ef55301695cee3f9f35754e688c3d399f847f79455"
    },
    {
      "path": "test/qualification/parallel_zones/abundance_02",
      "size": 342,
      "sha256": "d47640a4e77720b40fdd6c00adb580af2d9666b8c44c71ac5a898b004003ff77"
    },
    {
      "path": "test/qualification/parallel_zones/abundance_03",
      "size": 342,
      "sha256": "64025031ee19328b37d07e2b73669f138235770e564490aa63887b8449bc61a3"
    },
    {
      "path": "test/qualification/parallel_zones/abundance_04",
      "size": 340,
      "sha256": "90339859e851bda2e65afaca80da4dd94abedc1fdad86c62d9d046dcb3e9b171"
    },
    {
      "path": "test/qualification/parallel_zones/abundance_05",
      "size": 345,
      "sha256": "958d4f6ff90d5236072f2dac36f1e8a506b5eb75346a2a501b9966b16a4a9b8d"
    },
    {
      "path": "test/qualification/parallel_zones/abundance_06",
      "size": 343,
      "sha256": "2df4451d5973c1c9dcecf5da624b6b0aa6214a69706059ad125a42a91b8102e0"
    },
    {
      "path": "test/qualification/parallel_zones/abundance_07",
      "size": 342,
      "sha256": "9d93d2e253b231450d4da61cccee65c2c28182c24763b71d9819fe43fab14a61"
    },
    {
      "path": "test/qualification/parallel_zones/abundance_08",
      "size": 348,
      "sha256": "297623f4dc21b70f26f631171cda9428b0b7b13dd123e19bcdce27adb38e4dbd"
    },
    {
      "path": "test/qualification/parallel_zones/abundance_09",
      "size": 348,
      "sha256": "ccec78440b717117c64504eaefa2555e249d8f752c0f8f8d91407f0ebb883296"
    },
    {
      "path": "test/qualification/parallel_zones/abundance_10",
      "size": 356,
      "sha256": "a1e6aedbe29ec0e9db3b4217610735a4cb628b961680323253f59cb596be6a67"
    },
    {
      "path": "test/qualification/parallel_zones/control",
      "size": 1840,
      "sha256": "35dc82d9e17a6851f91e92f46264de1f46260f78d8c28e6c946034b9f62db3e0"
    },
    {
      "path": "test/qualification/parallel_zones/thermo_01",
      "size": 149,
      "sha256": "fc1bcc1fe590cb45fe481a5f15915db9434197252bf749ae3ce78a942c1334b0"
    },
    {
      "path": "test/qualification/parallel_zones/thermo_02",
      "size": 149,
      "sha256": "b4f5aa0e01db8c9c3161347d99f840cf17c1e637fc4f595c3499ca1953095cd0"
    },
    {
      "path": "test/qualification/parallel_zones/thermo_03",
      "size": 149,
      "sha256": "a8ad13c59abe325c0ab722083f38fc4d0ab3f6909b183a2a5f943cd15a722a36"
    },
    {
      "path": "test/qualification/parallel_zones/thermo_04",
      "size": 149,
      "sha256": "8626968a115e950b3fb15eeda485f911134759dd5c9c48f157d3c537d21d5e33"
    },
    {
      "path": "test/qualification/parallel_zones/thermo_05",
      "size": 149,
      "sha256": "3833c19de4a78b7acf1408ba6f13c356b302e3a7bd8c4ccf0ef195b405c25699"
    },
    {
      "path": "test/qualification/parallel_zones/thermo_06",
      "size": 149,
      "sha256": "0186b2ca373c83233610d6c604710abeb11e79ab898a89818f714d265794b073"
    },
    {
      "path": "test/qualification/parallel_zones/thermo_07",
      "size": 149,
      "sha256": "982c1650de2b677d2c5e4eafd88bac5ee96b4a52d33120adf174848da305c7ed"
    },
    {
      "path": "test/qualification/parallel_zones/thermo_08",
      "size": 149,
      "sha256": "588a1b7e78cb60d8d30811e722401fa5ce1df2cf426611b1f0d9bb9767d591cd"
    },
    {